,komentar,tanggal,hasil,merk
0,yaallah bingung mo samsung xiaomi,2023-04-17T03:00:00Z,5,xiaomi
1,xiaomi t ga masuk nominasi jt an,2023-04-17T03:00:00Z,5,xiaomi
2,rekomendasi hp xiaomi flagship harga jutaan,2023-04-17T03:00:00Z,5,xiaomi
3,bantu pengguna vivo pgn coba xiaomi worth it g ya? mending ttp vivo,2022-12-18T02:41:40Z,5,xiaomi
4,samsung galaxy m vs infinix zero vs xiaomi poco m pro oke ngonten tiktok editing capcut?,2022-12-18T02:41:40Z,5,xiaomi
5,xiaomi,2022-07-27T04:00:13Z,5,xiaomi
6,xiaomi note,2022-08-19T03:45:00Z,5,xiaomi
7,xiaomi mi t pro xiaomi mi t pro bagus,2022-11-26T09:23:06Z,5,xiaomi
8,xiaomi t nggak masuk kategori hp rekomendasi,2022-04-24T09:13:28Z,5,xiaomi
9,hasil dr xiaomi lbh ky ‘photography’ by pro bgt  tone warna- udah film bgt  yha…,2022-08-07T03:39:22Z,5,xiaomi
10,xiaomi kasih lensa dslr kan?,2022-08-07T03:39:22Z,5,xiaomi
11,video malam fix menang xiaomi ,2022-08-07T03:39:22Z,5,xiaomi
12,inti low light bagus xiaomi,2022-08-07T03:39:22Z,5,xiaomi
13,sebener xiaomi dah bener menyesuaikan photo ai live editing   gw sekian hasil photo xiaomi dah bener,2022-08-07T03:39:22Z,5,xiaomi
14,xiaomi   blom faham karakter leica   musti ba k ngobrol deep talk  ,2022-08-07T03:39:22Z,5,xiaomi
15,contoh gambar diatas emang xiaomi mempu kontras fibanding huawei tp suka gambar pu xiaomi pu huawei warna kaya aga filter kuning gambar xiaomi warna kaya filter gitu warna pu huawei contoh mode vibrance xiaomi,2022-08-07T03:39:22Z,5,xiaomi
16,perspektif sy bel r motret  huawei hasil dr sony mirrorles camera dinamicrange lebar  xiaomi emang beneran leica  dgn kontras black level tebal kanan iphone hasil kamera canon  warna biru kulit bagus  berdasarkan cahaya warna mnurut sy sih krna pu ketiga brand kamera tsb    liat xiaomi emg udh leica bgt  liat hasil coba cek review leica series yutub,2022-08-07T03:39:22Z,5,xiaomi
17,software xiaomi buruk,2022-08-07T03:39:22Z,1,xiaomi
18,xiaomi ultra,2023-01-16T06:49:57Z,5,xiaomi
19,xiaomi tu hasil kamera dramatis bgt,2023-01-16T06:49:57Z,5,xiaomi
20,xiaomi pro bagus woth it harga     makasih review om,2023-01-16T06:49:57Z,5,xiaomi
21,gaskeunlah xiaomi    diantos pisan,2023-01-16T06:49:57Z,5,xiaomi
22,elegan keren et tuh xiaomi pro  ,2023-01-16T06:49:57Z,5,xiaomi
23,secanggih apapun merk xiaomi tetep kaya iklan buka setting iklan buka gallery iklan ngetik keyboard iklan ,2023-01-16T06:49:57Z,5,xiaomi
24,pasar indo gak sih? brand xiaomi pakai snap naga gen ya kayak,2023-01-16T06:49:57Z,5,xiaomi
25,xiaomi hp full iklan,2023-01-16T06:49:57Z,5,xiaomi
26,brand bersejarah chanel gadgetin xiaomi,2023-01-16T06:49:57Z,5,xiaomi
27,xiaomi nunggu harga bekas turun turun”,2023-01-16T06:49:57Z,5,xiaomi
28,review xiaomi nga masuk indo  merk sdh masuk gw tunggu- nga masuk  one***s nga disangka- sdh lolos tkdn- kaya gw ambil deh ,2023-01-16T06:49:57Z,5,xiaomi
29,david review xiaomi ultra,2023-01-16T06:49:57Z,5,xiaomi
30,klo order xiaomi pro dimana ya,2023-01-16T06:49:57Z,5,xiaomi
31,hp siemens sih dah pakai xiaomi redmi c,2023-04-13T08:01:15Z,1,xiaomi
32,xiaomi kl ngasih hardware emangn joran ya,2023-03-28T06:57:23Z,5,xiaomi
33,bantu mendingan xiaomi redmi/note poco plis butuh bgt,2023-03-28T06:57:23Z,5,xiaomi
34,xiaomi lite vs gimana    unggul lite,2023-03-28T06:57:23Z,5,xiaomi
35,bandingin xiaomi lite redmi note pro,2023-03-28T06:57:23Z,5,xiaomi
36,mending vivo xiaomi?,2022-04-25T07:36:38Z,5,xiaomi
37,x beli seri xiaomi harga jt-an jujur gw gak nyesel beli xiaomi redmi s bnr bnr rusak sebulan artian harga jt-an tp kuat sampe ±th ram bikin temen-temen gw ngiler pgn hp karna pake maen mobile legend tuh lumayan enak kl settingan standar beli si redmi a karna budget mentok sejuta-an ter ta lumayan pemakaian sehari-hari bikin gw kaget hp extend ram up to gb (misal /+) keren sih xiaomi low budget pgn hp lumayan bagus cocok kamera mp tp ya harga jt-an ya overall gw redmi a bagus,2022-10-22T03:44:15Z,5,xiaomi
38,bagusan sm xiaomi t,2022-08-15T06:58:35Z,5,xiaomi
39,"xiaomi sengada lawang ""killer"" suasana keren",2022-09-15T04:07:10Z,5,xiaomi
40,bg udah sih dapet xiaomi dikit rezeki ny ️,2022-09-15T04:07:10Z,1,xiaomi
41,desain xiaomi mantap   ,2022-09-15T04:07:10Z,5,xiaomi
42,hai salam dri sarawak malaysia hp xiaomi google x mas  ,2022-09-15T04:07:10Z,5,xiaomi
43,xiaomi sebetul emang pilihan jaman sekarang  barang murah dibanding pesaing durabilitas komponen jaman teknologi cepet et berkem butuh durabilitas berlebih gitu?,2022-09-15T04:07:10Z,5,xiaomi
44,xiaomi produk merakyat bgt harga unit sparepart terjangkau oprekers doang man hp,2022-09-15T04:07:10Z,5,xiaomi
45,xperia z sejutaan xiaomi t dipake foto produk siang hasil et  xperia keren kamera mp vs mp mark iv,2022-07-15T06:12:09Z,5,xiaomi
46,pengalaman smartphone xperia s ganti xperia z xperia z dual  beralih xiaomi samsung mainstream  eh xiaomi dah mainstream,2022-07-15T06:12:09Z,5,xiaomi
47,xiaomi poco m bg,2022-12-01T04:00:15Z,5,xiaomi
48,semoga beli nih hp redmi note hilang curi realme pengen xiaomi fitur video foto ajib,2021-04-08T09:09:16Z,5,xiaomi
49,ya bener   x pu android ya xiaomi x,2020-05-30T05:44:55Z,5,xiaomi
50,bm garansi distributor akui xiaomi tangguh hp bandel et,2020-05-30T05:44:55Z,5,xiaomi
51,penggemar xiaomi redmi note t g pro g,2020-05-30T05:44:55Z,5,xiaomi
52,tp xiaomi dr spek layarr udah bermasalah ampunnnnn deh,2020-05-30T05:44:55Z,5,xiaomi
53,sayang xiaomi suku cadang hp susah dicari  hp udah keluaran rusak gabisa dibenerin  beli wkwkwk ,2020-05-30T05:44:55Z,5,xiaomi
54,iseng-iseng nyobain xiaomi redmi note alasan suka design simpel eh ter ta menelusuri pu alasan (diluar kamera oke) betah xiaomi pu tema sesimpel alasan skrg betah xiaomi ngga kompatibel tema miui tp udah diperbarui terima kasih xiaomi,2020-05-30T05:44:55Z,5,xiaomi
55,yoi xiaomi,2020-05-30T05:44:55Z,5,xiaomi
56,beli xiaomi redmi prime hp sejutaan terbaik dlu thn / ,2020-05-30T05:44:55Z,5,xiaomi
57,maaf nih realme xiaomi? pake xiaomi batre cepet panas ,2020-05-30T05:44:55Z,5,xiaomi
58,tau xiaomi sosis,2020-05-30T05:44:55Z,5,xiaomi
59,xiaomi brand lawak sebagus bagus xiaomi gua bagus hp merek kelas dibawah,2020-05-30T05:44:55Z,5,xiaomi
60,buatan cina xiaomi realmi oppo hancurkan produk apple amerika    mahal dlm pemakaian ribet   maka amerika benci cina hegemoni bidang elektronik mobil militer udah hancurkan sma cina,2020-05-30T05:44:55Z,5,xiaomi
61,alasan     tapi sejuta alasan xiaomi terbentuk chanel,2020-05-30T05:44:55Z,5,xiaomi
62,sampe gw nemuin hape remot nye somay    gw ngidam sih hp anti air cm gak remot nye gak jd deh    semoga kedepan xiaomi ngeluarin hape bersertifikat ip ip dgn mempertahankan spek dewa harga masuk akal     klo ip k brenang   ,2020-05-30T05:44:55Z,5,xiaomi
63,ka izin ta screenshoot foto gabisa dibuka kirim langsung ya jd manual masuk galeri dulu? xiaomi lite ku setting gmn ya biar langsung send,2022-07-19T07:30:04Z,3,xiaomi
64,mending xiaomi lite redmi note pro?,2022-07-19T07:30:04Z,5,xiaomi
65,cari hp kelas harga utk pemakaian normal sehari menekankan arah foto video hasil utk konten ga main game sekali   kakak recomend xiaomi lite kompetitor,2022-07-19T07:30:04Z,5,xiaomi
66,pakai xiaomi lite  ya internet jadj lola    kartu perdana dipindahkan hp normal aka hp lain  hp lola   suka kamera stabil natural    mantap deh,2022-07-19T07:30:04Z,5,xiaomi
67,memilih redmi note pro g xiaomi lite?,2022-07-19T07:30:04Z,5,xiaomi
68,mending xiaomi lite xiaomi redmi note pro?,2022-07-19T07:30:04Z,5,xiaomi
69,mending xiaomi lite samsung a?,2022-07-19T07:30:04Z,5,xiaomi
70,xiaomi ba k iklan nggak sih    ?,2022-07-19T07:30:04Z,5,xiaomi
71,mantap xiaomi lite redmi pro g,2022-07-19T07:30:04Z,5,xiaomi
72,klu bandingkan dg xiaomi redmi note gimana mas ,2021-02-06T05:38:29Z,5,xiaomi
73,samsung  s ama xiaomi mi bagus nih,2020-05-06T03:24:20Z,5,xiaomi
74,vs xiaomi lite oke hp kamera ok maen game berat,2023-03-16T01:00:33Z,5,xiaomi
75,yaallah bingung mo samsung xiaomi,2023-04-17T03:00:00Z,5,xiaomi
76,mending poco m pro samsung a ya?,2023-04-17T03:00:00Z,1,samsung
77,user samsung as g nyimak hp gak obat hardware terbaik brand terbaik modding community udah idup ok fix th br ganti hp kwkwkw,2022-12-18T02:41:40Z,5,samsung
78,sedih bet zaman pake hp samsung j pro,2022-12-18T02:41:40Z,5,samsung
79,abis liat ni video langsung beli samsung ae wkwk,2022-12-18T02:41:40Z,5,samsung
80,samsung j prime bs dipake,2022-12-18T02:41:40Z,1,samsung
81,samsung galaxy m vs infinix zero vs xiaomi poco m pro oke ngonten tiktok editing capcut?,2022-12-18T02:41:40Z,5,xiaomi
82,harga sgtu we beli samsung si,2022-07-27T04:00:13Z,5,samsung
83,masuk indo harga jt klo dibandingin samsung a harga sm² jt msh mending a cm spesial led,2022-07-27T04:00:13Z,3,samsung
84,harga samsung a skrg y ram gb/internal gb,2022-11-26T09:23:06Z,1,samsung
85,klo game pilih rog phone klo layar ama camera samsung suka et ama sony,2022-11-26T09:23:06Z,5,samsung
86,klo gua samsung s ultra gak ad obeng,2022-08-07T03:39:22Z,3,samsung
87,bole tuker hp advan dgn hp samsung galaxy tab s oppo as kak butuh et bikin konten drama sss,2021-07-17T01:00:06Z,5,samsung
88,hp impian samsung as samsung s ultra,2020-10-02T03:30:00Z,1,samsung
89,samsung canggih nama z fold harga murah juta,2020-10-02T03:30:00Z,5,samsung
90,trik tips mengetik layak kertas print samsung galaxy tab s ultra,2020-10-02T03:30:00Z,1,samsung
91,samsung emang handpone berkelas dunia   ,2020-10-02T03:30:00Z,2,samsung
92,pu hp samsung j pro ga tergoda pengen liat sosmed  liat wa youtube s,2020-10-02T03:30:00Z,5,samsung
93,gak mewah gk terkenal orang indo bingung hp mahal murah pake iphone pro max samsung s ultra mewah,2022-04-13T03:00:17Z,5,samsung
94,dr w pecinta samsung ama apple  ,2021-11-19T03:03:15Z,1,samsung
95,oppo enak? data aktif iklan bermunculan ketik sy pake oppo a menjengkelkan layar hidup data diaktifkan iklan bermunculan menghapus jg susah capek sy peke oppo mending vivi samsung klo samsung gk ribet vivo jg lbh bagus klo oppo capek deh bikin emosi,2021-11-19T03:03:15Z,2,samsung
96,hpku samsung j liat hp gini berasa gemetaran ka  harga,2023-04-13T08:01:15Z,1,samsung
97,unboxsing review samsung a g,2023-04-13T08:01:15Z,1,samsung
98,unboxsing review samsung a g,2023-04-13T08:01:15Z,1,samsung
99,promoin tokped dipegang hp samsung pas nunjukin promo berubah jdi ip,2022-08-25T09:03:26Z,5,samsung
100,mending samsung fold dimana,2023-03-28T06:57:23Z,4,samsung
101,video kamera sdh fps blm sdh ois klau hp compare samsung a a dr segi mesin hasil jepretan kamera/video mending,2023-03-28T06:57:23Z,1,samsung
102,samsung x bmw,2022-12-04T04:00:10Z,2,samsung
103,kl samsung a g bagus kk,2022-04-25T07:36:38Z,5,samsung
104,samsung a mending   ,2022-04-25T07:36:38Z,5,samsung
105,terimakasih aras saran david samsung galaxy semoga sukses ngerivew,2022-09-17T02:01:29Z,5,samsung
106,ha pake samsung kelas,2022-09-17T02:01:29Z,4,samsung
107,beli samsung z fold hp pakai pemakaian normal rusak layar (layar lipat kabar pergantian samsung seminggu sy tunggu kabar gak hiraukan payah,2022-09-17T02:01:29Z,1,samsung
108,service samsung kek anjeeeeng,2022-09-17T02:01:29Z,4,samsung
109,david pijamin samsung beli,2022-09-17T02:01:29Z,1,samsung
110,blng sm orng samsung klau dy jual harga jt sy lbgsung ludes seba k jt pcs hhhh,2022-09-17T02:01:29Z,5,samsung
111,daya ku nonton pake samsung j prime,2022-09-17T02:01:29Z,5,samsung
112,samsung galaxy s ultra! number one phone   its amazing    incredible,2023-02-22T03:00:34Z,5,samsung
113,alhamdulillah udah beli hp impian galaxy s suka et samsung,2023-02-22T03:00:34Z,5,samsung
114,review samsung galaxy s edisi bmw donk  ,2023-02-22T03:00:34Z,4,samsung
115,david toko hp rekomended beli hp samsung toko,2023-02-22T03:00:34Z,5,samsung
116,beli samsung s ultra gokil pake compare iphone promax kamera samsung juara ya karna pake,2023-02-22T03:00:34Z,5,samsung
117,nge-bahas samsung dex- menit david,2023-02-22T03:00:34Z,1,samsung
118,zfold gua batre eror  persentase -% langsung mati  ganti zfold pakai s ultra eh rusak kena garis layar mikir upgrade s kepincut zfold  eh kena pe kit juga  apes apes apes dah pake samsung ,2023-02-22T03:00:34Z,1,samsung
119,ip pro samsung s ultra ya,2023-02-22T03:00:34Z,5,samsung
120,halo gadgetin review samsung s gak yaaa kaya cakep gitu dia  smoga dibaca thank you hehee,2023-02-22T03:00:34Z,5,samsung
121,ka plis bales konten mua bagusan beli oppo reno apa? keba bilang pake apple maaf suka dompet wkwk kualitas foto video riasan pengantin bagus oppo reno apa?apa samsung ka?,2022-08-15T06:58:35Z,1,samsung
122,mending oppo reno pro g samsung ssih bingung??,2022-08-15T06:58:35Z,4,samsung
123,user fold ha lihat fisik device terpenting ui feature kestabilan os fold membantu produktivitas kerja ha mobile phone flagship  samsung konsisten mengeluarkan versi flip fold generasi perbaikan sisi hardware durabilitas otomatis mature daily driver ha sekedar concept phone (tetapi ringkih) ,2022-09-15T04:07:10Z,1,samsung
124,org beli hp cina buly nokia samsung ericson  org indo cinta produck cina,2022-09-15T04:07:10Z,5,samsung
125,pake samsung dus nih,2022-09-15T04:07:10Z,5,samsung
126,fixed tetep samsung    ,2022-09-15T04:07:10Z,5,samsung
127,pengen et pu hp rog gak pu uang beli gua udah bosen pake hp samsung tetep bersukur,2022-07-25T11:36:02Z,5,samsung
128,beli oppo find x pro g  vivo x pro g samsung s ultra g,2019-06-07T02:26:01Z,5,samsung
129,beli hp samsung series z fold saranin beli dulu  total keluarga beli hp z fold kali pu trouble layar rusak  hp z fold gb pakai layar kamera selfie rusak  tukar ter ta layar rusak  papa teman pu z fold layar rusak  coba research ter ta hp z fold layar gampang rusak  biaya perbaikan worth it harga perbaikan jutaan samsung service  beli hp samsung ditekuk tekuk menunggu ketahanan kualitas terjamin  semoga kedepan hp samsung model ditekuk tahan ,2021-08-11T14:04:22Z,4,samsung
130,jelasin samsung lahin tulisan verizon ngerti maksud,2021-08-11T14:04:22Z,1,samsung
131,trik tips mengetik layak kertas print samsung galaxy tab s ultra,2021-08-11T14:04:22Z,1,samsung
132,dynamic islamd technologi tercanggi dunia  waaa dynamic islan woooo    wkkwkw goo samsung ,2021-08-11T14:04:22Z,5,samsung
133,minat samsung galaxy z fold g gaa,2021-08-11T14:04:22Z,1,samsung
134,pen beli terpisah sdh hp samsung z fold,2021-08-11T14:04:22Z,5,samsung
135,samsung pu kemewahan manan tersendiri mengikuti brand ssst kali vivo x fold udah rilis coba bandingin worth it?/,2021-08-11T14:04:22Z,5,samsung
136,hp android sony m hp sony timeless bgt awet  sayang sony indonesia menjual dibanding samsung pdhal sony,2022-07-15T06:12:09Z,2,samsung
137,pengalaman smartphone xperia s ganti xperia z xperia z dual  beralih xiaomi samsung mainstream  eh xiaomi dah mainstream,2022-07-15T06:12:09Z,5,xiaomi
138,sony mmg org berjiwa seniman lensa analog dg lensa seniman ba k suka analog dibanding digital dlm posisi digital menampilkan sisi natural analog seniman suka kamera analog cari sony sdgkan suka digital cari samsung ,2022-07-15T06:12:09Z,5,samsung
139,pake hp samsung apa?,2022-07-15T06:12:09Z,3,samsung
140,yaelah gamungkin gua pake samsung j ace,2022-11-01T09:00:04Z,1,samsung
141,riview samsung j prime,2022-11-01T09:00:04Z,1,samsung
142,oppo a samsung a bagus,2022-04-07T09:45:18Z,5,samsung
143,unboxing samsung j prime bg,2022-06-01T08:52:03Z,5,samsung
144,lg saudara samsung,2021-04-14T04:18:54Z,4,samsung
145,beli resmi pake samsung ae,2023-03-05T01:05:41Z,5,samsung
146,ya  allah dapet hp a oppo karna hp samsung pecah kelomdes teman beliin hp oppo a semoga awet,2023-03-05T01:05:41Z,5,samsung
147,xiomi hp terbaik termurah samsung terbaik menengah apel,2020-05-30T05:44:55Z,5,samsung
148,xiomy samsung jual mahal ,2020-05-30T05:44:55Z,5,samsung
149,samsung redmi/xiomi bagusan,2020-05-30T05:44:55Z,5,samsung
150,xiaome samsung negara korea selatan hp product mobil (car),2020-05-30T05:44:55Z,5,samsung
151,gue samsung mania        liat hp temen merk merk tiongkok         gue alergi        anak gue beli hp xiomi dgn harga dr mahal         dgn full fitur    ram       gue buang samsung     seklokan        trus beli hp xiomi redmi note s udah harga murah habis       dibawah jt an       dpt ram kamera full fitur      samsung dgn ram fitur kyk gitu       seharga jt an    ,2020-05-30T05:44:55Z,5,samsung
152,mending xiaomi lite samsung a?,2022-07-19T07:30:04Z,5,xiaomi
153,mantap merek samsung,2022-05-25T10:00:19Z,5,samsung
154,jutaan? mendingan samsung z fold jutaan,2022-05-25T10:00:19Z,1,samsung
155,nonton review hp pakai samsung e ya beli gituan,2022-05-25T10:00:19Z,5,samsung
156,samsung bg,2020-12-25T10:00:29Z,2,samsung
157,samsung a?,2020-05-06T03:24:20Z,5,samsung
158,samsung  s ama xiaomi mi bagus nih,2020-05-06T03:24:20Z,5,xiaomi
159,review samsung ms,2020-05-06T03:24:20Z,4,samsung
160,coba comparasi samsung a ip kek seru tu cari hp harga jt an,2023-03-16T01:00:33Z,5,samsung
161,gua masi make samsung j+ umur uda th,2023-03-16T01:00:33Z,1,samsung
162,pake samsunga+ udah thn,2023-03-16T01:00:33Z,1,samsung
163,bagus samsung a g sfe?,2023-03-16T01:00:33Z,1,samsung
164,recomendasi charger merek samsung a aman sesuai kapasitas fast charging   ,2023-03-16T01:00:33Z,5,samsung
165,vivo v vs samsung a unggul,2023-03-16T01:00:33Z,1,samsung
166,pakai samsung a mudah²an kebeli samsung ter update aamiin,2023-03-16T01:00:33Z,2,samsung
167,mending beli ipone samsung a g bg,2023-03-16T01:00:33Z,1,samsung
168,alhamdulillah sdh pu samsung a g,2023-03-16T01:00:33Z,5,samsung
169,samsung a g kereeeen   ,2023-03-16T01:00:33Z,1,samsung
170,nonton pake samsung as nyimak,2023-03-16T01:00:33Z,5,samsung
171,kak ta samsung a vivo v worth it ya kak,2023-03-16T01:00:33Z,5,samsung
172,mas pertengahan rekomen samsung as a?,2023-03-16T01:00:33Z,5,samsung
173,main game ok foto foto mntap     samsung kualitas gk diragukan     rog blacshark mati total harga selangit,2023-02-02T03:02:29Z,4,samsung
174,pu salah hp samsung s series udah gk penasaran dg spek hp cari kek gmna udah ‍️,2023-02-02T03:02:29Z,1,samsung
175,bro david kendala ga s ultra?apakah ui bug kah?karena s ultra sehabis update ui minggu pemakaian sabtu pagi tanggal maret muncul garis hijau (greenline) layar sabtu subuh jam wib subuh layar lcd normal greenline indikasi hp jatuh tertimpa tertindih barang berat ter injak terduduki sekali tetapi pagi muncul greenline teman teman pegguna galaxy s series galaxy note series mengalami kejadian setela update muncul greenline apakah bug update os samsung bermasalah?tetapi pas bawa samsung service center ha sarankan mengganti lcd berta bug update terbaru bilang masalah dan keberatan mengganti lcd sebabkan update ui os terbaru samsung muncul greenline kesalahan pribadi (human eror) hp terjatuh lcd retak berkenan bantu sharing video perta an terima kasih sukses gadgetin bro david sekian terima kasih,2023-02-02T03:02:29Z,1,samsung
176,udah coba redeem e voucher sgi saya  samsung care,2023-02-02T03:02:29Z,5,samsung
177,bahas hp samsung seponsor mpl id season,2023-02-02T03:02:29Z,1,samsung
178,hp b harga kayak iphone,2022-07-27T04:00:13Z,1,iphone
179,rekom iphone sih an,2022-07-27T04:00:13Z,3,iphone
180,pemantapan beli iphone pro new generation ,2022-08-07T03:39:22Z,5,iphone
181,dah iphone aman,2022-08-07T03:39:22Z,5,iphone
182,menang huawei iphone,2022-08-07T03:39:22Z,5,iphone
183,perspektif sy bel r motret  huawei hasil dr sony mirrorles camera dinamicrange lebar  xiaomi emang beneran leica  dgn kontras black level tebal kanan iphone hasil kamera canon  warna biru kulit bagus  berdasarkan cahaya warna mnurut sy sih krna pu ketiga brand kamera tsb    liat xiaomi emg udh leica bgt  liat hasil coba cek review leica series yutub,2022-08-07T03:39:22Z,5,xiaomi
184,kta malaysia harga hp mahal rm tapi iphone,2022-04-13T03:00:17Z,5,iphone
185,hp g mnding iphone murah ga maluin ditambah spek gg asli kalah andoid,2022-04-13T03:00:17Z,5,iphone
186,iphone kelas,2022-04-13T03:00:17Z,5,iphone
187,gak mewah gk terkenal orang indo bingung hp mahal murah pake iphone pro max samsung s ultra mewah,2022-04-13T03:00:17Z,5,samsung
188,segahar semewah apapun xiomi tetep david pale haria iphone  hohoho,2023-01-16T06:49:57Z,1,iphone
189,pengguna iphone  jujur bagusan hasil kamera iphone  keliatan maksa et bandingin xiomi iphone,2023-01-16T06:49:57Z,5,iphone
190,future termahal dunia jutaan iphone pro max sultan emas!,2022-08-25T09:03:26Z,5,iphone
191,dikorea fold mahal iphone,2022-09-17T02:01:29Z,5,iphone
192,iphone bocil bocil udah pu,2022-09-17T02:01:29Z,4,iphone
193,ga tau ganti iphone fold layar luas,2022-09-17T02:01:29Z,1,iphone
194,resolusi kualiatas hasil upload poto video wa instagram melebihi kualitas iphone?,2022-09-17T02:01:29Z,5,iphone
195,hp d rekomend sultra iphone pro max???,2023-02-22T03:00:34Z,1,iphone
196,beli samsung s ultra gokil pake compare iphone promax kamera samsung juara ya karna pake,2023-02-22T03:00:34Z,5,samsung
197,pakai iphone pro th blm dah aq ganti oppo krna dah kecewa iphone kagak beli iphone oppo terdepan bgiku,2022-08-15T06:58:35Z,1,iphone
198,berasa bergengsi megang hp sony terbaru iphone,2022-07-15T06:12:09Z,5,iphone
199,rog phone pro lawan iphone promax game enakan ??dan stabil,2022-11-01T09:00:04Z,5,iphone
200,"""ada berani lawan?"" komparasi iphone galaxy s",2022-11-01T09:00:04Z,2,iphone
201,fan boy lg sih pake lg g jaman sedge masiu jt kamera lg g dual camera wide ultra wide posisi lgi gencargemcar pake yi cam gorpo bipro sayangmya pamor g kalah melengkunng layar sedge sampe lg g iya v sayang lg ba k pe kit seri flagsip g gampamg matot g software g g kamera ntaj berjamur kamera gimana jelek sih hpn ngikutin kamera ultra wide pas udh iphone ketimggalan thn,2021-04-14T04:18:54Z,5,iphone
202,rekomendasi iphone pro bekas ya mas like koment video pu mas david,2020-04-25T03:00:19Z,5,iphone
203,kirim in iphone hdc (semoga bales),2020-04-25T03:00:19Z,4,iphone
204,beli iphone hdc dimana?,2020-04-25T03:00:19Z,1,iphone
205,boss qu iphone     gak bagus iphone s h mah,2020-04-25T03:00:19Z,1,iphone
206,jt iphone kw tpi menangis camera rusak gtu,2020-04-25T03:00:19Z,5,iphone
207,beli hp iphone harga jt tp takut hdc kmera x sih ok,2020-04-25T03:00:19Z,5,iphone
208,ga sadar iphone android d;,2020-12-07T09:11:48Z,2,iphone
209,machines toko ya?? bantu mrk jual iphone rts ??? iphone rts ad pro max   sdgkan asli puluhan juta   penasaran????,2023-03-05T01:05:41Z,1,iphone
210,ane beli sony ya biasalah limbah jepang keterangan wifi only gapapa sih ngincer kamera klo beli iphone mahal wkwk,2023-03-05T01:05:41Z,1,iphone
211,orang korea jepang pake hp iphone,2021-02-06T05:38:29Z,5,iphone
212,untung gw nonton beli iphone ibox gak minat beli sceond sih barang apapun,2021-12-02T04:00:08Z,5,iphone
213,anjir gue takut cekout iphone shoope hdc persis ori et,2021-12-02T04:00:08Z,4,iphone
214,temen beli hp iphone kw bilang asli,2021-12-02T04:00:08Z,5,iphone
215,hp iphone pro mex harga,2021-12-02T04:00:08Z,1,iphone
216,beli iphone gegsi beli iphone cinematik,2021-12-02T04:00:08Z,5,iphone
217,temanku pu iphone hdc ga,2021-12-02T04:00:08Z,3,iphone
218,pesen iphone hdc,2021-12-02T04:00:08Z,5,iphone
219,bg kamera iphone hdc jernih dibanding iphone pro max pas muka a foto iphone pro max gelap muka a iphone hdc muka a putih time iphone pro max pro max,2021-12-02T04:00:08Z,5,iphone
220,bg donk iphone hdc,2021-12-02T04:00:08Z,5,iphone
221,tetangga gw pake iphone pro max posting foto burem et,2021-12-02T04:00:08Z,1,iphone
222,mohon maaf iphone gak suka ikutan pu prinsip menjaring user,2022-05-25T10:00:19Z,3,iphone
223,handphone china tdk mnglahkan handphone buatan amerika orang china sndri pke iphone china h mnciplak,2022-05-25T10:00:19Z,5,iphone
224,anak grafika/atau orang ngerti warna   warna iphone sierra purplish penambahan pigmen magenta/merah ga ba k  vivo bener david biru/cyan pigmen blue/cyan white ba k warna keluar  cakepan vivo sih warna imo,2022-05-25T10:00:19Z,1,iphone
225,bahas harga iphone murah sampe mahal,2020-05-06T03:24:20Z,5,iphone
226,pemakaian game addicted ya suka bantai android wkwkwk !! iphone sayang h r kecuali     competitive yes ok wajib ios match  tapi notabene harian android game ,2022-03-07T12:22:27Z,5,iphone
227,oppo reno gwe aman gaming sosmed dam kerja harian,2023-03-22T03:51:19Z,4,oppo
228,coba riview oppo reno word it gak ini  ,2023-03-22T03:51:19Z,5,oppo
229,pengen bgt oppo a produksi lgi  nangis bgt dlu hpku hilang    cri oppo a susah bgt ga produksi,2023-03-22T03:51:19Z,1,oppo
230,kayak bodoh jual hp vivo y beli minggu tukar hp bekas oppo a in uang rb pikir beli hp bekas seharga jt an,2023-03-22T03:51:19Z,1,oppo
231,hp oppo th mati  tlp berdering  ,2023-03-22T03:51:19Z,1,oppo
232,hp oppo bagus ya mid range,2023-04-17T03:00:00Z,5,oppo
233,tolong bkin perbandingan oppo vivo xiomi bingung,2022-04-24T09:13:28Z,3,oppo
234,bole tuker hp advan dgn hp samsung galaxy tab s oppo as kak butuh et bikin konten drama sss,2021-07-17T01:00:06Z,5,samsung
235,pake oppo tpi versi rendah,2021-11-19T03:03:15Z,1,oppo
236,hp oppo boros batre beda hp,2021-11-19T03:03:15Z,1,oppo
237,waw oppo pabrik bersih,2021-11-19T03:03:15Z,5,oppo
238,brand oppo smart phone ku,2021-11-19T03:03:15Z,5,oppo
239,terbaik oppo indonesia,2021-11-19T03:03:15Z,5,oppo
240,kren is ok oppo,2021-11-19T03:03:15Z,5,oppo
241,oppo indonesia    slebew    perakitan kalix bro   ,2021-11-19T03:03:15Z,1,oppo
242,gue pake oppo r pro udah mesin ya bagus body bagus terjun bebas saku celana tahan banting,2021-11-19T03:03:15Z,5,oppo
243,oppo eman gue lempar tembok hp ga,2021-11-19T03:03:15Z,5,oppo
244,oppo enak? data aktif iklan bermunculan ketik sy pake oppo a menjengkelkan layar hidup data diaktifkan iklan bermunculan menghapus jg susah capek sy peke oppo mending vivi samsung klo samsung gk ribet vivo jg lbh bagus klo oppo capek deh bikin emosi,2021-11-19T03:03:15Z,2,samsung
245,percaya et kwalitas oppo sy pu hp oppo a sy ojol th jatuh ngojol carger nancep ngojol sampe skr thn hp sy normal gak bermasalah beli thn kwalitas terjamin ,2021-11-19T03:03:15Z,5,oppo
246,good pake oppo jg,2021-11-19T03:03:15Z,5,oppo
247,pkek hf oppo as pakek vivo,2021-11-19T03:03:15Z,4,oppo
