,komentar,tanggal,hasil,merk
323,bagusan infinix zero infinix zero g,2023-04-08T05:05:54Z,1,infinix
324,dikafe kafe kadang infinix wkwkw,2023-04-17T04:00:13Z,4,infinix
325,samsung galaxy m vs infinix zero vs xiaomi poco m pro oke ngonten tiktok editing capcut?,2022-12-06T12:00:03Z,5,xiaomi
326,mending ambil infinix zero infinix zero g ya? pemakaian sehari sosmed chatting telfon youtube netflix foto main game ml,2022-12-06T12:00:03Z,5,infinix
327,update system infinix gak pemerataan g negara konoha jg gak jd takut abis beli hp  jt msih g tp besok g dah wkwk,2022-12-06T12:00:03Z,2,infinix
328,btw skrg infinix sdh menjamin update software thn utk infinix zero,2022-12-06T12:00:03Z,5,infinix
329,lupa infinix zero g spek ngeri,2022-12-06T12:00:03Z,1,infinix
330,om gak masukin infinix zero g,2022-12-06T12:00:03Z,5,infinix
331,om penangkapan signal wifi infinix zero bermasalah ya?,2022-12-06T12:00:03Z,1,infinix
332,infinix zero g masuk  ngegame gila sih barang ghoib,2022-12-06T12:00:03Z,3,infinix
333,infinix zero ultra ter ta masuk rekomendasi nih,2022-12-07T14:00:47Z,5,infinix
334,bagusan kamera samsung m vs infinix zero ini?,2022-10-15T12:40:08Z,1,samsung
335,lawan infinix zero g donk,2022-10-15T12:40:08Z,1,infinix
336,zero kualitas bnr premium et oem premium khusus kualitas display bnr sekelas flagship suara bagus et ngebass bulet bening et outdoor diadu s ato iphone interface coba diaktifin fitur bnr mewah et highly recommended enak drpd s iphone beda et kualitas produk infinix kmgknan ba k pake jeroan oem si vivo,2022-10-15T12:40:08Z,5,iphone
337,komen klu infinix bagus sc,2022-10-15T12:40:08Z,5,infinix
338,jual infinix zero second harga,2022-10-15T12:40:08Z,5,infinix
339,infinix aman ga ya? denger temen pake infinix hp cepet panas kadang meledak ,2022-10-15T12:40:08Z,4,infinix
340,om saran infinix hp com genggaman jang keba hp bongsor mksh om   ,2022-10-15T12:40:08Z,5,infinix
341,teman teman ta foto video stabil mending poco x nfc infinix zero,2022-10-15T12:40:08Z,1,infinix
342,serius saran  beli hp bingung redmi note pro g infinix zero oppo a realme kamera video'y bagus yaa live tiktok,2022-10-15T12:40:08Z,5,oppo
343,infinix jual niru ala xiaomi jaman murah kasih fiture bagus xiaomi kesini mengecewakan ,2022-10-15T12:40:08Z,5,xiaomi
344,gw hbs beli ni hp gw download apk aida gw cek disitu kamera blkg mp kamera mp beda vivo bini gw bener mp gw cek aida gw compare et infinix menang kecerahan doang klo vivo detail et hasil kamera gw compare dg hp mi lite gw skrg jd hp anak gw gw beli pakek pay later,2022-10-15T12:40:08Z,3,vivo
345,mas ta dong   beli infinix zero second msh garansi sih sampe    ta pas cek antutu cpuz kamera rear mp front mp mp mp yaa,2022-10-15T12:40:08Z,4,infinix
346,lampu kuning merk udah berkibar lbh lama    bbrp nongol tp infinix bawa kwalitas ga kalah tp d im i dgn harga lbh ramah  type produsen mendengar keluhan konsumen ,2022-10-15T12:40:08Z,4,infinix
347,kertas spek infinix zero gk kekurangan tinggal pengoptimalan,2022-10-15T12:40:08Z,5,infinix
348,suara infinix jernih bget,2022-10-15T12:40:08Z,3,infinix
349,zero infinix poco m pro,2022-10-15T12:40:08Z,4,infinix
350,enak ambil poco m pro infinix zero ya,2022-10-15T12:40:08Z,5,infinix
351,anjir bingung samsung m infinix zero,2022-10-15T12:40:08Z,5,samsung
352,recomended mna infinix zero ato redmi note pro? blas ya bg,2022-10-15T12:40:08Z,5,infinix
353,nitip segi kamera tolong komper infinix zero vs realme pro plus salam palem,2022-10-15T12:40:08Z,1,infinix
354,nih review infinix zero g,2022-10-15T12:40:08Z,3,infinix
355,layar hapehape infinix pova ga pake screen protector gorilla dst  itu dimasukan minus,2022-12-03T04:58:00Z,5,infinix
356,user infinix hot s nyimak,2022-12-03T04:58:00Z,4,infinix
357,timestamp tambahan infinix hot s,2022-12-03T04:58:00Z,5,infinix
358,bingung pilih vivo yt infinix hot s nfc mending ya?,2022-12-03T04:58:00Z,5,vivo
359,ekhem infinix zero x pro,2022-12-03T04:58:00Z,5,infinix
360,infinix zero x pro,2022-12-03T04:58:00Z,5,infinix
361,mending poco m poco m pro infinix hot s?,2022-12-03T04:58:00Z,4,infinix
362,saran bagusan infinix hot s infinix note semoga,2022-12-03T04:58:00Z,5,infinix
363,user infinix zero bersyukur dual kamera beneran  ,2023-04-24T04:30:10Z,1,infinix
364,infinix layar ga gorilla glass ,2023-03-15T03:30:02Z,3,infinix
365,perusahaan infinix ui,2022-12-14T05:30:10Z,5,infinix
366,kebutuhan travelling mending tecno camon infinix zero ya?,2022-12-14T05:30:10Z,5,infinix
367,seri infinix hot s warna putih tulisan hot muncul kena sinar siang ungu gelap hijau glow in the dark,2022-12-14T05:30:10Z,3,infinix
368,game bagus ya infinix zero g poco x g ?tolong rekomendasi bro,2023-02-20T05:06:56Z,5,infinix
369,infinix pu bug gitu emang iya?,2023-02-20T05:06:56Z,1,infinix
370,bingung bungkus infinix zero g iqoo zx disatu sisi ngiler dimensity tp butuh batre badak charger kilat coba infinix batre udh pilih doi,2023-02-20T05:06:56Z,5,infinix
371,bingung nih milih infinix note vip    mohon saran dong  ,2023-02-20T05:06:56Z,2,infinix
372,"alhamdulillah udh beli hp sumpahhh sih ni hp emezing     game berat kek sungkem ni hp ga panas kayak x***i pake sampe jam an suhu w r sih ku hasil kamera ga buruk"" mayan harga segitu   pake hp cuman pake fungsi utama geming   good job infinix  ",2023-02-20T05:06:56Z,5,infinix
373,na knp sisa ram infinix zero g ku tinggal dikit ya aplikasi dikit gk berjalan dilatar,2023-02-20T05:06:56Z,5,infinix
374,hp infinix beli fast charging bagus fast charging,2023-02-20T05:06:56Z,5,infinix
375,coba infinix pake sd wow,2023-02-20T05:06:56Z,5,infinix
376,gara gara infinix gw upgrade hape,2023-02-20T05:06:56Z,5,infinix
377,bermain game tulisan meng-akses mengganti akses pengaturan  infinix zero g mengatasi menghilangkan ny gimna,2023-02-20T05:06:56Z,1,infinix
378,saran klo kamera perekamanan mending iqoo x g  samsung m g rilis  infinix zero g terimakasih semoga terjawab,2023-02-20T05:06:56Z,4,samsung
379,gw awam ragu barnd ya? yakinin gak infinix aman,2023-02-20T05:06:56Z,1,infinix
380,dikotak bandung layanan service infinix mengecewakan bln sparepart tdk ada nyesel beli infinix kirain layanan service merk langsung ditangani beli infinix rusak langsung buang s,2023-02-20T05:06:56Z,5,infinix
381,cari uan debugin hp infinix gimana ?saya cari gak ketemu,2020-06-14T10:40:33Z,5,infinix
382,nonton video coba mode pro infinix note s&i naikan gelap cahaya sedikitpun hasil siang hari ,2020-04-03T11:47:20Z,5,infinix
383,infinix,2021-06-13T04:18:41Z,5,infinix
384,infinix hots vs infinix hot g bagusan mana?? maen game berat,2022-12-24T05:46:40Z,5,infinix
385,fitur infinix hot g jeroa infinix hot s,2023-03-28T08:30:19Z,5,infinix
386,lawan saudara keluarga transsion holding merek infinix note / atau saingan dri bbk group si realme c lbh mahal rban,2023-03-28T08:30:19Z,1,infinix
387,dibanding infinix mending ya?,2023-03-28T08:30:19Z,5,infinix
388,gua rog ma sony si mahal,2023-04-17T04:00:13Z,5,sony
389,samsung type kapasitas batre hp et harga jt udah gak karu-karuan   samsung nda berharap product laku keras musuh abadi sony experia gulung tikar samsung awan  ,2023-03-02T03:53:20Z,1,samsung
390,na lakukan tv sony inc gue   biar nonton k youtube lancar sentosa   gue ilmu provider wifi gue pkai  udalama sih   tapi emang joss  ,2023-04-16T04:00:04Z,5,sony
391,pu sony sensor apsc pu xiaomi oke gmn sensor om ded? apsc lho,2023-05-09T10:00:35Z,5,xiaomi
392,pu sony kayak gitu berasa keren et pas pu,2023-05-09T10:00:35Z,1,sony
393,lg samsung s zoom series udah terjual klo gasalah seri s s zoom kaka ipar gw pake  hybrid android smartphone+pocket camera (point n shoot cam)  lensa ya mendem kaya keba pocket cam  sony kayak jg lensa bs masuk mendem vendor merk lupa jg,2023-05-09T10:00:35Z,3,samsung
394,sony wireless    wireless bitret berpengaruh,2023-05-09T10:00:35Z,4,sony
395,iya juga  inget sony gw lupa,2023-05-09T10:00:35Z,5,sony
396,sony pelopor hp android lensa wireless dunia hp modul diganti (camera ram rom baterai) diminati pasar hp gagal jual pasaran dikem i hp pake lensa kamera langsung gimana gitu b sih,2023-05-09T10:00:35Z,5,sony
397,sony lakuin olympus jg pernah  olympus air a ga salah nama,2023-05-09T10:00:35Z,1,sony
398,sony kek universal (bisa hp) lensa leica dipasang hp konsep xiaomi lensa m-mount full manual sony pakai e-mount autofocus,2023-05-09T10:00:35Z,5,xiaomi
399,ya gw lupa sony,2023-05-09T10:00:35Z,5,sony
400,berharap sony lanjutin kamera model kyk gitu  langsung beli pocket-camera harga beli hape lagi  klw kamera hape udh bagus bwt sehari-hari  kecuali ningkatin zoom ois sendiri ,2023-05-09T10:00:35Z,4,sony
401,"sy emang butuh sih ip rating ini   tuntutan kerjaan dilapangan anak sipil :malus om ip smartphone nama ""sonim xp"" sertifikasi militer ""mil-std g"" (lupa sy kode dibelakang f g sy inget g lbh tahan benturan keras jatuh ketinggian brpa mtr gitu) next jr bs jelasin militer standard rating stlh ip rating dibahas ini  sy pengguna sonim dr xp enduro samsung b samsung b dkk (hp tetot tetot sblm smartphone) sony ericsson xperia active  jd sy makai hp ip rating tuntutan kerjaan sy  overall edukasi keren channel",2020-09-08T12:23:40Z,1,samsung
402,gw bertahan pake hp sony kamera wkwk,2023-04-24T04:30:10Z,5,sony
403,om brand smartphone pake kamera buatan sony dri entri sma high?,2023-04-24T04:30:10Z,1,sony
404,sayang sony ga resmi lg xperia pro ii hp dgn kamera bagus,2022-12-18T11:06:16Z,5,sony
405,gw gak pake gituan hardcase macem  karna menikmati detail desain desain seri sony xperia beuh elegan ,2023-03-15T03:30:02Z,3,sony
406,mohon tanggapi kaka camera sony a colokin kabel hdmi video capture pc obs tdk tersambung ya layar kamera mati la mati la kak  pedahal ps to hdmi video capture kak  coba carema monitor hp hasil dilayar kamera mati la mati la kak  coba tanggapi kak  kebingunngan tutorial yt tdk membahas alami ini  sony a  rute sy pakai camera hdmi micro to hdmi video capture pc- obs sekian terimakasih,2020-06-14T10:40:33Z,5,sony
407,alhamdulillah beli gadget second nemu bermasalah gatcha sony samsung  pembeli paham kondisi standar barbek meminimalisir resiko pintar reputasi karakter penjual ,2022-01-14T07:18:41Z,5,samsung
408,iqoo zx rekomen ga diharga jtaan? tlg bantu jwb,2023-04-08T05:05:54Z,3,lg
409,kl dipasang situasi pas lg ne? ganggu koneksi device ga? org rumah lg terhubung wi-fi si router pasang itu  gmn dg koneksi hp device lain? terputus kah?,2023-04-16T04:00:04Z,5,lg
410,disamping modem ngapain colok hp lg? gak,2023-04-16T04:00:04Z,1,lg
411,gw ko nagkep lu lg jualan note lite yah,2019-08-20T23:53:39Z,1,lg
412,"gw harap  hp merk jgn ikutin samsung gk menyediakan charger  ribet sih klau pd ngikutin gituan  beli charger pula  org rata"" beli hp biar lgsg pakai  ribetin lg  lgian klau udh kelas menengah msak untk charger msh kluar dana lg beli charger",2023-03-15T10:07:50Z,2,samsung
413,liat layar inci berasa nostalgia jaman hp jadul inc keperluan,2023-03-02T00:35:43Z,1,lg
414,lg samsung s zoom series udah terjual klo gasalah seri s s zoom kaka ipar gw pake  hybrid android smartphone+pocket camera (point n shoot cam)  lensa ya mendem kaya keba pocket cam  sony kayak jg lensa bs masuk mendem vendor merk lupa jg,2023-05-09T10:00:35Z,3,samsung
415,om trus gmna samsung series galaxy galaxy zoom gk salah gk payah beli lg lensa krna lensa pu mekanikal kyk kamera dslr zoom in out,2023-05-09T10:00:35Z,3,samsung
416,lensa leica summilux f jt  bt beli flgship smartphone mirrorles apsc ,2023-05-09T10:00:35Z,5,lg
417,yah mending beli dslr lgsng ngapain beli hp,2023-05-09T10:00:35Z,4,lg
418,suka lg klo gratis g,2023-01-21T01:41:06Z,3,lg
419,serasa lg kuliah,2020-05-16T10:32:11Z,4,lg
420,kak lg cari hp android live streaming tok² camera jernih ya kk?,2022-12-07T14:00:47Z,5,lg
421,pake hp gw lg samsung m,2023-04-25T04:00:34Z,5,samsung
422,tp kerasa si kemaren pake hp g daerah gw ngerantau kuliah (makassar) beda et sm g jakarta  abis upgrade hp hp g lgsg berasa luwes kenceng drpd wifi download sm upload cuman ping masi ketahan beda klo pake wifi dsni -an game  klo jakarta mah g dpt ping -an ,2023-04-25T04:00:34Z,3,lg
423,konektor ku pernh kemasukan bensin   trss aq brsihin pake air biasa   trss lg heheeee  aman  tkut dampak bensin masuk konektor knapa,2020-04-13T11:51:38Z,5,lg
424,mas t p samsung as g coba bawa kolam renang apartemen bru sebentar udh layar y ngedrop trs coba matikan tp layar tdak ad respon trs lap cas hp y krn lobet tngal trs ad notif lepaskan charger hp lepaskan kmudian bunyi bunyi hp y    smpe mati hbis baterai y    stelah it keringkan beras harian charge lg gk hdup tp d charge getar     y knp y mas? y tahan air mas as g    mohon ad tau mengalami mohon mksh,2020-09-08T12:23:40Z,1,samsung
425,samsung a ip tp kmrn p q msuk k sungai lgsg mati d lcd flexibel konektor korosi wlopun g smpe gnti lcd tp smpat mati g bs d lakan,2020-09-08T12:23:40Z,1,samsung
426,sayang sony ga resmi lg xperia pro ii hp dgn kamera bagus,2022-12-18T11:06:16Z,5,sony
427,"kebutuhan masing"" ketinggalan jaman ha user mempu i mindest ""tiap ganti device baru"" mengalami cenderung puas diincar ha ""device baru"" device lgsg ngeluh beda dgn user mengutamakan kebutuhan contoh user ojol butuh device dgn battere gede alias badak disaat device dgn battere lbh gede user ojol tsbt mengeluh user tsbt membeli device sesuai kebutuhan",2022-06-03T11:43:30Z,5,lg
428,coba chipset dimensity ama kamera ultrawide lgsung angkut dah  berhubung kerjaan lensa ultrawide no ultrawide no go!,2022-12-14T05:30:10Z,5,lg
429,shutter s speed hpku ga nama speed  wb  ev  iso  shutter af tlg dijwb,2020-04-03T11:47:20Z,3,lg
430,serasa nostalgia et pu,2023-02-27T08:30:07Z,5,lg
431,kabar bergabung oppo lini flagship  sih entar masuk indo lg klo udah beneran gabung  yah gak gabung sodaraan y  aneh ya bbk grup emang,2023-02-27T08:30:07Z,1,oppo
432,om saran nih tes kamera klo bsa pakai hp hp lg d review kamera pakai hp lg review tp sya percaya hasil spark,2021-06-13T04:18:41Z,5,lg
433,menurutku hp jt++ udah kuat gim kog kupakek g kuat jago racik settingan udah lancar grafis bagus kupakek render high shadow low visual low sfx lowest grafik lanjutan medium bloom on anti alliasing on taa fps (klo kepanasan mending pakek tp hpku fps aman)     pakek g ram gb udah lancar bgt drop fps bntar tp langsung lancar lg gelud efek rame jg lancar honkai kanan lancar lg pakek karakter herrscer efek heboh     ya skeptis pas milih tp gr² budget mepet kucoba main ter ta jg kuat lancar    klo enak ya main pc i gen rx udah kuat high fps,2022-12-24T05:46:40Z,4,lg
434,om up komen senti melulu asumsi ayo rame² komen senti) coba om servis samsung lcd yarga harga device pu teman beli tv lg rusak garansi bayar uang mahal harga beli (mungkin murah selisih dikit et) ba k et part² dijual harga mendekati barang utuh,2022-01-14T07:18:41Z,1,samsung
435,gamen compare fancooler x lg viral gimana?,2021-12-30T03:50:11Z,2,lg
436,casing ga dilepas gimana ya? lgs tempel cooler casing,2021-12-30T03:50:11Z,1,lg
437,gg!! gokil sih anjir wkwk gw tau lagi  kekny gw nntn bsk lg dah  seru bener info,2023-03-17T03:30:11Z,4,lg
438,maaf bg nonton izin bg kah beli hp xiomi a dikampung cuman telpon hp nokia gantikan hp andoroid wa s,2022-11-29T06:25:00Z,4,nokia
439,ko nokia ga up yah? emang ga pasarkan indonesia emang ga recomended?,2022-11-29T06:25:00Z,2,nokia
440,nonton pakai nokia,2023-01-21T01:41:06Z,5,nokia
441,ta nokia bagus gk beli taun ini?,2020-08-07T07:19:59Z,5,nokia
442,orangtua fasih memakai smartphone orangtua bokap nyokap kemarin beli nokia c bokap nyokap user setia nokia aosp simple mudah beradaptasi jg nenek duluan advan g h/k ng rin kakek jg hp kampung tinggal nyokap bokap alot pu pulsa/gratis telpon sms pascabayar numpang paman rumah ga nenek ,2023-03-13T03:35:40Z,5,nokia
443,era symbian java    hp bekas    nokia     awet    teknologi ga serewel sekarang   menurutku)   klo sekarang   ponsel bekad coba hp docomo   batre bocor lcd ganti juga    klo laptop   apapun itunmau hp laptop   minimal klo main barang bekas gitu gituan   minimal paham hardware software deh   biar trouble   servive ganti ganti komponen doang   tau teknisi nakal  cari untung    lcd docomo an   mintain service sampe    sayan beli online    ganti sendiri   liat yutub,2022-01-14T07:18:41Z,1,nokia
444,pengen na mendingan ambil redmi c tecno pova neo yah? mohon saran,2022-11-29T06:25:00Z,5,redmi
445,redmi ga recomend,2022-11-29T06:25:00Z,3,redmi
446,redmi ga masuk,2022-11-29T06:25:00Z,2,redmi
447,redmi c et sih   ,2022-11-29T06:25:00Z,5,redmi
448,klo redmi vs redmi not    bagus mna kak??,2022-11-29T06:25:00Z,5,redmi
449,redmi note g gak masuk yak  serasa nyesel beli ni hp wkkwkw,2022-12-06T12:00:03Z,1,redmi
450,mohon arahan mending redmi note pro g samsung a ??,2022-12-06T12:00:03Z,5,samsung
451,redmi note pro g bg,2022-12-06T12:00:03Z,1,redmi
452,redmi note pro g ga masuk rekomendasi tau alasan knp? pengen beli redmi note pro g,2022-12-06T12:00:03Z,3,redmi
453,habis dengerin video ikhlas redmi note g pake sd,2020-05-16T10:32:11Z,2,redmi
454,pu ku hp vivo yi ces ori redmi not gpp,2020-01-28T09:51:09Z,5,vivo
455,hp redmi beli dicas ya gk,2020-01-28T09:51:09Z,1,redmi
456,msh pake hp xiaomi redmi a ttp bersyukur,2022-04-23T09:42:58Z,5,xiaomi
457,sih oke redmi note pro,2022-04-23T09:42:58Z,4,redmi
458,serius saran  beli hp bingung redmi note pro g infinix zero oppo a realme kamera video'y bagus yaa live tiktok,2022-10-15T12:40:08Z,5,oppo
459,recomended mna infinix zero ato redmi note pro? blas ya bg,2022-10-15T12:40:08Z,5,infinix
460,redmi ku udah kali kena bugs d sistem pemakain tahun  jd kyk mnding ambil miui dh,2022-12-03T04:58:00Z,5,redmi
461,redmi note pro worth it ga,2022-12-03T04:58:00Z,5,redmi
462,redmi note g s susah et dicari,2022-12-03T04:58:00Z,3,redmi
463,redmi note bagus ga ini?,2022-12-03T04:58:00Z,5,redmi
464,izin menyimak memakai redmi note pro pakai pas februari ini(awal relase official) rasakan ke- baterai drop memutuskan ganti baterai tanam gadget viral snapdragon fingerprint dual camera  ya game ml/pubg berat multitasking app sosmed delay  pengen ri pengganti om ya minimal jangka lah  melirik mediatek g recommended jujur anti mediatek review review gadget timbul panas ga awet  mencoba snapdragon g si pembuat samsung hasil produksi baik  dana jt gadget rekomendasikan ya om?,2022-12-03T04:58:00Z,5,samsung
465,redmi note aman jangka keren,2023-04-25T04:00:34Z,5,redmi
466,alhamdulillah kepakai redmi note pro daily driver,2020-08-07T07:19:59Z,4,redmi
467,sih redmi note pro udh mtdk helio gt harga jutaan,2020-08-07T07:19:59Z,4,redmi
468,redmi note,2020-08-07T07:19:59Z,5,redmi
469,redmi note pro msh msuk list yah  ,2020-08-07T07:19:59Z,3,redmi
470,telat nonto udah sebulan  daftar hp realme i redmi note pro huawei nova t black shark huawei p pro huawei mate pro bonus ketawa ketawa lagi  mantap om   sukses selalu ,2020-08-07T07:19:59Z,1,redmi
471,beli hp redmi a hasil lemot enak batre tahan nonton youtube,2023-03-13T03:35:40Z,5,redmi
472,wkwkw laci redmi note pro g nganggur krn males kegedean,2023-04-29T09:00:18Z,1,redmi
473,gua redmi quad kamera pas gua cek tripel doang kepake gak kepake samsekali,2023-04-24T04:30:10Z,3,redmi
474,redmi note nyimak,2023-04-24T04:30:10Z,5,redmi
475,daya sanggup beli redmi note pro  ,2019-12-10T09:46:56Z,5,redmi
476,ntar redmi note pro max udah resmi masuk indo tolong dirivew bandingin samsung galaxy a   gw pu budget jt rencana beli a pas tau redmi note pro max launching nonton spesifikasi fitur niat gw beli a jdi goyah ditambah gw nonton video jagat rivew snapdragon g bim gw    gw ga nyesel ngeluarin duit jt harga -jt gw spesifikasi fitur jt   pliiss dengerin keluh kesah subscriber mu ini  ,2019-12-10T09:46:56Z,1,samsung
477,nonton redmi note pro,2019-12-10T09:46:56Z,5,redmi
478,@jagat review om ded jual xiaomi redmi note pro ️ susah cari brang sya cod ksna,2019-12-10T09:46:56Z,5,xiaomi
479,pngn beli redminote pro samsung as  lbh rekomended tuk redminote pro iklan msh mer lela ga ya??,2019-12-10T09:46:56Z,1,samsung
480,pake xiaomi redmi note a bertahan sampe terpaksa ganti hp jatoh trus layar pecah wkwkwkw alhamdulillah gak ganti hp hahahah,2022-06-03T11:43:30Z,5,xiaomi
481,pake redmi prime sampe karna enak man upgrade android karna perkem an zaman pesat udah beli redmi prime normal  still be legend prime terima kasih info menarik om ded ,2022-06-03T11:43:30Z,5,redmi
482,menunggu redmi note g rilis indonesia,2022-06-03T11:43:30Z,3,redmi
483,om pemakaian jangka beli samsung m g beli redmi s g?,2022-06-03T11:43:30Z,5,samsung
484,redmi note beli januari sampe detik gak dipakein protector tuh aman,2023-03-15T03:30:02Z,5,redmi
485,hp gw redmi note pro gorila glas gores kuku,2023-03-15T03:30:02Z,5,redmi
486,redmi plus distributor pakai android pikiran ganti hp mass,2023-05-01T04:58:00Z,5,redmi
487,dibanding redmi note pro gimana?,2023-02-20T05:06:56Z,5,redmi
488,kalah sam redmi,2021-06-13T04:18:41Z,5,redmi
489,keren redmi g dapet c+ hp dikelas harga mentok dapet c,2022-12-24T05:46:40Z,5,redmi
490,iphone gb ga lag dikit gpp la pengen main genshin hp redmi ku ga support,2022-12-24T05:46:40Z,5,iphone
491,mending redmi note kemana-mana,2023-01-08T03:30:00Z,1,redmi
492,menang storage harga gk beda redmi note s  rb varian,2023-03-28T08:30:19Z,3,redmi
0,saran f gt xiaomi mending,2023-03-31T14:18:54Z,5,xiaomi
1,realme pro pkus xiaomi lite ga masuk rekom ya    rekomended ya    harga jg sama   butuh utk game ringan   genshin impact low ga kamera mantap  ,2023-03-31T14:18:54Z,5,xiaomi
2,xiaomi mi lite masuk ga,2023-03-31T14:18:54Z,5,xiaomi
3,bagusan sih f gt xiaomi,2023-04-30T11:35:39Z,5,xiaomi
4,realme pro plus g ga rekomended ya mas mouldie? foto bagus kalah xiaomi kah?,2023-04-30T11:35:39Z,5,xiaomi
5,istri beli renot pro g suami beli xiaomi lite sandingkan teliti gak nyesal ngambil xiaomi lite mantap,2023-04-30T11:35:39Z,5,xiaomi
6,ta iphone lolos tkdn gak pu pabrik indonesia flagship xiaomi gak masuk gak memenuhi tkdn pabrik batam?,2023-04-30T11:35:39Z,1,xiaomi
7,xiaomi udah jt an gak dimasukin    s vanila udah jt an,2023-02-27T12:01:50Z,1,xiaomi
8,jutaan ketinggalan xiaomi lite tuh om,2023-02-27T12:01:50Z,5,xiaomi
9,xiaomi pro layak dibeli? tunggu xiaomi pro sekalian?,2023-02-27T12:01:50Z,5,xiaomi
10,a hasil kualitas kamera video foto xiaomi t samsung a suka mana?,2023-01-28T11:10:25Z,3,xiaomi
11,timestamp opening realme pro samsung a g xiaomi redmi a realme c tecno pova neo iklan shopback tecno pova pro poco m pro samsung m realme narzo g samsung m poco f xiaomi t poco f gt samsung a iklan smartphone samsung galaxy zfold kedepan closing terimakasih tim sobat hape segmen manja suka,2023-01-28T11:10:25Z,1,xiaomi
12,nokia aman service enak dipakai beli hp xiaomi ko,2022-12-26T10:47:16Z,5,xiaomi
13,pake xiaomi x beli bertahun gak ganti hp ahir dinkasi nokia c bos pake seminggu gak tahan xiaomi x jelek nokia c kalah xiaomi x udah pake tahun ,2022-12-26T10:47:16Z,5,xiaomi
14,nama nokia no gua pu brand merek oppo vivo realme xiaomi sony samsung iphone asus infinix kenangan jaman ku ha nokia,2022-12-26T10:47:16Z,5,xiaomi
15,samsung xiaomi memindahkan data game sd card??,2019-05-18T13:14:41Z,5,xiaomi
16,jngnkn rb kamera unggul tmen gw jual tuh hp rb type xiaomi redmi s,2022-06-16T15:27:10Z,5,xiaomi
17,advan xiaomi,2022-06-16T15:27:10Z,5,xiaomi
18,taan seindah bre coba niru rival minimal xiaomi laku,2022-06-16T15:27:10Z,5,xiaomi
19,canggih bagusan xiaomi advan  xiaomi go internasional advan pasaran indo s berani nantang xiaomi?? silahkan cek xiaomi s ultra bossku wkwkwkwk advan org hidup pas²an,2022-06-16T15:27:10Z,5,xiaomi
20,habis liat xiaomi s ultra kaya emang gonjreng tuh color science leica deh,2022-06-24T14:09:36Z,5,xiaomi
21,mahal hp kalahin xiaomi bisa? merakyat,2022-10-21T13:59:21Z,5,xiaomi
22,setidak oppo inves buka lapangan pekerjaan walupun dikatain produk kemahalan dibading xiaomi hp terlaris pabrik dompelng pabrik wkwkwk kyak gak niat inves indo,2022-10-21T13:59:21Z,5,xiaomi
23,fans xiaomi terdiam,2022-10-21T13:59:21Z,5,xiaomi
24,share pengalaman belanja redmi a shopee barang diterima rusak gsm y gak kebaca  baruuu bgt unboxing eeeh ter ta gabisa dipake udah ajuin pengembalian barang dana shopee buang cek y lamaaa bgt tp dibalikin kondisi rusak wkwk ter ta ba k review beli hp xiaomi kerusakan pabrik pengajuan klaim ditolak  belanja official store ecommerce aman  ter ta engga kapok sih belanja mereka  noted:kamera jg jelek bgt,2022-10-27T10:13:08Z,1,xiaomi
25,ane ga suka ui xiaomi   mending dah pure andro,2022-10-27T10:13:08Z,5,xiaomi
26,xiaomi hypercharge w? w?,2022-03-17T04:39:06Z,5,xiaomi
27,tau hape support pd gmn ya? bingung bgt pilih charger sesuai infinix zero charger bawaan w rusak klaim garansi tunggu berhari pu w xiaomi gak cocok error pas cass  pengen beli anker aukey acmic harga ribu lbh eh blm fast charging muncul hiksss bingung bgt,2022-03-17T04:39:06Z,5,xiaomi
28,hp v= a max bearti pake charger v= a maksimal )  gunakam charger v=a pu xiaomi charger w charger sscara maksimal  inti,2022-03-17T04:39:06Z,2,xiaomi
29,bro kepala charger xiaomi poco m pro g recommended yaa ??,2022-03-17T04:39:06Z,5,xiaomi
30,udah males pakai samsung layar bergaris hijau kesalahan user emang pe kit oled claim garansi bilang hp jatuh wkwk ngakak gua claim layar vivo seri x bergaris layani cek membatalkan garansi ga cek ga layar ganti gratis xiaomi gitu matot ganti unit sung sung aturan lu melek iya bener layar lu bagus lu tau layar lu gampang pe kitan shadow gampang kena brand,2023-02-02T06:54:23Z,1,xiaomi
